NAME,CITY,STATE,COUNTY,NAICSDESCR,X,Y,SUBTYPE,DENOM,PROT,CATH
CHURCH OF THE SACRED HEART AND SAINT MARY OUR LADY OF CZESTOCHOWA,NEW YORK MILLS,NY,ONEIDA,CHURCHES,-75.2850559,43.1075802,CHRISTIAN,NOT AVAILABLE,N,Y
KAGYU DZAMLING KUNCHAB TIBETAN BUDDHIST CENTER,NEW YORK,NY,NEW YORK,PLACES OF WORSHIP,-73.9753861,40.7825009,BUDDHIST,"LOTUS SUTRA, DAIMOKU (NICHIREN)",N,N
CHABAD OF THE WEST SIXTIES,NEW YORK,NY,NEW YORK,SYNAGOGUES,-73.9834308,40.7756189,JUDAIC,CHABAD,N,N
CITY GRACE CHURCH,NEW YORK,NY,NEW YORK,CHURCHES,-73.9996228,40.7294009,CHRISTIAN,NOT AVAILABLE,Y,N
CHABAD OF DOWNTOWN NEW YORK CITY,NEW YORK,NY,NEW YORK,SYNAGOGUES,-74.0172701,40.708011,JUDAIC,CHABAD,N,N
FIRST CALVARY BAPTIST CHURCH,NEW YORK,NY,NEW YORK,CHURCHES,-73.9453638,40.8271298,CHRISTIAN,NBC,Y,N
CHURCH OF OUR LADY OF ESPERANZA,NEW YORK,NY,NEW YORK,CHURCHES,-73.9465793,40.8336321,CHRISTIAN,NOT AVAILABLE,N,Y
CHURCH OF THE GOOD SHEPHERD,NEW YORK,NY,NEW YORK,CHURCHES,-73.950268,40.7617269,CHRISTIAN,EPIS,Y,N
CHURCH OF SAINT MARK THE EVANGELIST,NEW YORK,NY,NEW YORK,CHURCHES,-73.938271,40.8157047,CHRISTIAN,NOT AVAILABLE,N,Y
SECOND SAINT JOHN BAPTIST CHURCH,NEW YORK,NY,NEW YORK,CHURCHES,-73.9503788,40.804287,CHRISTIAN,NBC,Y,N
ANTIOCH BAPTIST CHURCH,NEW YORK,NY,NEW YORK,CHURCHES,-73.9565553,40.8141955,CHRISTIAN,ABC,Y,N
MASJID SABUR,NEW YORK,NY,NEW YORK,"MOSQUES, RELIGIOUS",-73.9452648,40.8138254,MUSLIM,NOT AVAILABLE,N,N
WADSWORTH AVENUE BAPTIST CHURCH,NEW YORK,NY,NEW YORK,CHURCHES,-73.9340935,40.8515934,CHRISTIAN,ABC,Y,N
BEULAH BAPTIST CHURCH,NEW YORK,NY,NEW YORK,CHURCHES,-73.9443091,40.8116457,CHRISTIAN,ABC,Y,N
CHAMBERS MEMORIAL BAPTIST CHURCH,NEW YORK,NY,NEW YORK,CHURCHES,-73.9358639,40.8022537,CHRISTIAN,ABC,Y,N
CANAAN BAPTIST CHURCH OF CHRIST,NEW YORK,NY,NEW YORK,CHURCHES,-73.9515245,40.8025,CHRISTIAN,COC,Y,N
CHURCH OF SAINT MATTHEW AND SAINT TIMOTHY,NEW YORK,NY,NEW YORK,CHURCHES,-73.971821,40.7843953,CHRISTIAN,EPIS,Y,N
NEW YORK CITY CHURCH OF CHRIST,NEW YORK,NY,NEW YORK,CHURCHES,-73.9451755,40.8289035,CHRISTIAN,COC,Y,N
INDIAN BUDDHIST ASSOCIATION,NEW YORK,NY,NEW YORK,PLACES OF WORSHIP,-73.9282038,40.857563,BUDDHIST,"INDIAN THERAVADA, MAHAYANA",N,N
ISLAMIC CULTURAL CENTER OF NEW YORK,NEW YORK,NY,NEW YORK,"MOSQUES, RELIGIOUS",-73.9485756,40.7854647,MUSLIM,NOT AVAILABLE,N,N
CONGREGATION SHAARE HATIKVAH,NEW YORK,NY,NEW YORK,SYNAGOGUES,-73.9376878,40.8493513,JUDAIC,NOT AVAILABLE,N,N
CONGREGATION OF SAINT SAVIOUR AT THE CATHEDRAL,NEW YORK,NY,NEW YORK,CHURCHES,-73.9614868,40.8037858,CHRISTIAN,EPIS,Y,N
THE EPISCOPAL CHURCH OF THE HEAVENLY REST,NEW YORK,NY,NEW YORK,CHURCHES,-73.9581536,40.7837398,CHRISTIAN,EPIS,Y,N
96TH STREET SANGHA,NEW YORK,NY,NEW YORK,PLACES OF WORSHIP,-73.9721745,40.7950975,BUDDHIST,"MAHAYANA, ZEN/PURELAND",N,N
MASJID MALCOLM SHABAZZ,NEW YORK,NY,NEW YORK,"MOSQUES, RELIGIOUS",-73.9502268,40.8019996,MUSLIM,NOT AVAILABLE,N,N
HARLEM CHURCH OF CHRIST,NEW YORK,NY,NEW YORK,CHURCHES,-73.9442688,40.808782,CHRISTIAN,COC,Y,N
THE CHURCH OF THE INCARNATION,NEW YORK,NY,NEW YORK,CHURCHES,-73.9364302,40.8451168,CHRISTIAN,NOT AVAILABLE,N,Y
GREATER CALVARY BAPTIST CHURCH,NEW YORK,NY,NEW YORK,CHURCHES,-73.9444103,40.8066704,CHRISTIAN,ABC,Y,N
EBENEZER AFRICAN METHODIST EPISCOPAL CHURCH,NEW YORK,NY,NEW YORK,CHURCHES,-73.9377736,40.8025197,CHRISTIAN,AME,Y,N
GREATER FILE CHAPEL BAPTIST CHURCH,NEW YORK,NY,NEW YORK,CHURCHES,-73.9444124,40.8324665,CHRISTIAN,NBC,Y,N
LAGREE BAPTIST CHURCH,NEW YORK,NY,NEW YORK,CHURCHES,-73.953385,40.8108907,CHRISTIAN,NBC,Y,N
NEW SONG COMMUNITY MISSION,NEW YORK,NY,NEW YORK,CHURCHES,-73.9530998,40.8070916,CHRISTIAN,PCA,Y,N
MACEDONIA BAPTIST CHURCH,NEW YORK,NY,NEW YORK,CHURCHES,-73.9458452,40.8259248,CHRISTIAN,NBC,Y,N
BETHEL AFRICAN METHODIST EPISCOPAL CHURCH,NEW YORK,NY,NEW YORK,CHURCHES,-73.9410159,40.8115306,CHRISTIAN,AME,Y,N
CONVENT AVENUE BAPTIST CHURCH,NEW YORK,NY,NEW YORK,CHURCHES,-73.9460552,40.8242782,CHRISTIAN,NBC,Y,N
EMANUEL AFRICAN METHODIST EPISCOPAL CHURCH,NEW YORK,NY,NEW YORK,CHURCHES,-73.9460711,40.8033546,CHRISTIAN,AME,Y,N
EMMANUEL PRESBYTERIAN CHURCH,NEW YORK,NY,NEW YORK,CHURCHES,-73.9620206,40.8112627,CHRISTIAN,PCA,Y,N
GREATER CENTRAL BAPTIST CHURCH,NEW YORK,NY,NEW YORK,CHURCHES,-73.9393464,40.8108273,CHRISTIAN,NBC,Y,N
MOUNT CALVARY BAPTIST CHURCH,NEW YORK,NY,NEW YORK,CHURCHES,-73.9419659,40.820574,CHRISTIAN,NBC,Y,N
MOUNT NEBOH BAPTIST CHURCH,NEW YORK,NY,NEW YORK,CHURCHES,-73.9529927,40.8019132,CHRISTIAN,NBC,Y,N
SAINT LUKE AFRICAN METHODIST EPISCOPAL CHURCH,NEW YORK,NY,NEW YORK,CHURCHES,-73.9443368,40.8302852,CHRISTIAN,AME,Y,N
SECOND CANAAN BAPTIST CHURCH,NEW YORK,NY,NEW YORK,CHURCHES,-73.9517516,40.7985648,CHRISTIAN,NBC,Y,N
SOUTHERN BAPTIST CHURCH,NEW YORK,NY,NEW YORK,CHURCHES,-73.9600755,40.7995839,CHRISTIAN,NBC,Y,N
SHILOH BAPTIST CHURCH,NEW YORK,NY,NEW YORK,CHURCHES,-73.9458343,40.81307,CHRISTIAN,NBC,Y,N
SAINT JOSEPH CHURCH - YORKVILLE,NEW YORK,NY,NEW YORK,CHURCHES,-73.9486291,40.7771145,CHRISTIAN,NOT AVAILABLE,N,Y
CHURCH OF THE HOLY FAMILY,NEW YORK,NY,NEW YORK,CHURCHES,-73.968491,40.7527362,CHRISTIAN,NOT AVAILABLE,N,Y
SAINT JAMES AFRICAN METHODIST EPISCOPAL CHURCH,NEW YORK,NY,NEW YORK,CHURCHES,-73.9428095,40.8062633,CHRISTIAN,AME,Y,N
PARADISE BAPTIST CHURCH,NEW YORK,NY,NEW YORK,CHURCHES,-73.9449988,40.8357387,CHRISTIAN,NBC,Y,N
LITTLE WIDOWS MITE BAPTIST CHURCH,NEW YORK,NY,NEW YORK,CHURCHES,-73.9452043,40.8156119,CHRISTIAN,NBC,Y,N
L'EGLISE FRANCAISE DU SAINT ESPRIT,NEW YORK,NY,NEW YORK,CHURCHES,-73.9685726,40.763539,CHRISTIAN,EPIS,Y,N
CHURCH OF THE EPIPHANY,NEW YORK,NY,NEW YORK,CHURCHES,-73.9529276,40.7685771,CHRISTIAN,EPIS,Y,N
SAINT FRANCIS DE SALES CHURCH,NEW YORK,NY,NEW YORK,CHURCHES,-73.951492,40.7864331,CHRISTIAN,NOT AVAILABLE,N,Y
TRINITY AFRICAN METHODIST EPISCOPAL CHURCH,NEW YORK,NY,NEW YORK,CHURCHES,-73.9497423,40.810628,CHRISTIAN,AME,Y,N
CHURCH OF NOTRE DAME,NEW YORK,NY,NEW YORK,CHURCHES,-73.9603443,40.8050614,CHRISTIAN,NOT AVAILABLE,N,Y
SAINT CECILIAS CHURCH,NEW YORK,NY,NEW YORK,CHURCHES,-73.9470622,40.7922637,CHRISTIAN,NOT AVAILABLE,N,Y
CHURCH OF SAINT PAUL,NEW YORK,NY,NEW YORK,CHURCHES,-73.9416944,40.7998784,CHRISTIAN,NOT AVAILABLE,N,Y
OUR LADY OF MOUNT CARMEL CHURCH,NEW YORK,NY,NEW YORK,CHURCHES,-73.9340736,40.7948285,CHRISTIAN,NOT AVAILABLE,N,Y
MEMORIAL BAPTIST CHURCH,NEW YORK,NY,NEW YORK,CHURCHES,-73.9520891,40.8023807,CHRISTIAN,ABC,Y,N
CHURCH OF OUR LADY OF GOOD COUNSEL,NEW YORK,NY,NEW YORK,CHURCHES,-73.9509677,40.7806427,CHRISTIAN,NOT AVAILABLE,N,Y
CHURCH OF SAINT ELIZABETH OF HUNGARY,NEW YORK,NY,NEW YORK,CHURCHES,-73.9544509,40.7767439,CHRISTIAN,NOT AVAILABLE,N,Y
CHURCH OF THE GOOD SHEPHERD,NEW YORK,NY,NEW YORK,CHURCHES,-73.9203442,40.8684448,CHRISTIAN,NOT AVAILABLE,N,Y
BROADWAY UNITED CHURCH OF CHRIST,NEW YORK,NY,NEW YORK,CHURCHES,-73.9726903,40.7927133,CHRISTIAN,UCC,Y,N
METROPOLITAN AFRICAN METHODIST EPISCOPAL CHURCH,NEW YORK,NY,NEW YORK,CHURCHES,-73.9403537,40.8136518,CHRISTIAN,AME,Y,N
SAINT AMBROSE EPISCOPAL CHURCH,NEW YORK,NY,NEW YORK,CHURCHES,-73.9406715,40.8101555,CHRISTIAN,EPIS,Y,N
PALDEN SAKYA CENTER - NEW YORK,NEW YORK,NY,NEW YORK,PLACES OF WORSHIP,-73.9630541,40.7950156,BUDDHIST,"TIBETAN, SAKYA",N,N
MANHATTAN WON BUDDHIST TEMPLE,NEW YORK,NY,NEW YORK,"TEMPLES, RELIGIOUS",-73.9617326,40.7580704,BUDDHIST,RINZAI ZEN,N,N
PRIMERA IGLESIA BAUTISTA,NEW YORK,NY,NEW YORK,CHURCHES,-73.939451,40.797394,CHRISTIAN,ABC,Y,N
CHURCH OF SAINT CATHERINE OF GENOA,NEW YORK,NY,NEW YORK,CHURCHES,-73.9446134,40.8303098,CHRISTIAN,NOT AVAILABLE,N,Y
HOLY ROSARY CHURCH,NEW YORK,NY,NEW YORK,CHURCHES,-73.9328366,40.7971694,CHRISTIAN,NOT AVAILABLE,N,Y
MOTHER AFRICAN METHODIST EPISCOPAL ZION CHURCH,NEW YORK,NY,NEW YORK,CHURCHES,-73.9417831,40.815959,CHRISTIAN,AMEZ,Y,N
SAINT IGNATIUS LOYOLA PARISH CHURCH,NEW YORK,NY,NEW YORK,CHURCHES,-73.9588343,40.7789002,CHRISTIAN,NOT AVAILABLE,N,Y
ISLAMIC SOCIETY OF MID MANHATTAN,NEW YORK,NY,NEW YORK,"MOSQUES, RELIGIOUS",-73.9692592,40.7590562,MUSLIM,NOT AVAILABLE,N,N
CHURCH OF SAINT JOHN THE EVANGELIST,NEW YORK,NY,NEW YORK,CHURCHES,-73.9645594,40.7571025,CHRISTIAN,NOT AVAILABLE,N,Y
HOLYROOD EPISCOPAL CHURCH,NEW YORK,NY,NEW YORK,CHURCHES,-73.9384627,40.8494204,CHRISTIAN,EPIS,Y,N
MANHATTAN CHOGYE SAH TEMPLE,NEW YORK,NY,NEW YORK,"TEMPLES, RELIGIOUS",-73.9662552,40.792068,BUDDHIST,KWAN UM SCHOOL OF ZEN (KOREAN),N,N
THE GREATER HOOD MEMORIAL AFRICAN METHODIST EPISCOPAL ZION CHURCH,NEW YORK,NY,NEW YORK,CHURCHES,-73.93794,40.8218235,CHRISTIAN,AMEZ,Y,N
OUR LADY QUEEN OF ANGELS CHURCH,NEW YORK,NY,NEW YORK,CHURCHES,-73.9404647,40.7953337,CHRISTIAN,NOT AVAILABLE,N,Y
TURNER MEMORIAL AFRICAN METHODIST EPISCOPAL CHURCH,NEW YORK,NY,NEW YORK,CHURCHES,-73.9434276,40.8116669,CHRISTIAN,AME,Y,N
IGLESIA BAUTISTA DE WASHINGTON HEIGHTS,NEW YORK,NY,NEW YORK,CHURCHES,-73.931032,40.8501211,CHRISTIAN,ABC,Y,N
THE ABYSSINIAN BAPTIST CHURCH,NEW YORK,NY,NEW YORK,CHURCHES,-73.9415558,40.8166738,CHRISTIAN,NBC,Y,N
SAINT JAMES CHURCH,NEW YORK,NY,NEW YORK,CHURCHES,-73.9654155,40.7710872,CHRISTIAN,EPIS,Y,N
ALL SAINTS EPISCOPAL CHURCH,NEW YORK,NY,NEW YORK,CHURCHES,-73.9650264,40.7614496,CHRISTIAN,EPIS,Y,N
ACADEMY OF ISLAM,NEW YORK,NY,NEW YORK,"MOSQUES, RELIGIOUS",-73.9492742,40.8041746,MUSLIM,NOT AVAILABLE,N,N
CHURCH OF OUR LADY OF LOURDES,NEW YORK,NY,NEW YORK,CHURCHES,-73.9482547,40.8232481,CHRISTIAN,NOT AVAILABLE,N,Y
CHURCH OF OUR LADY QUEEN OF MARTYRS,NEW YORK,NY,NEW YORK,CHURCHES,-73.9280455,40.863777,CHRISTIAN,NOT AVAILABLE,N,Y
THE CHURCH OF THE CRUCIFIXION,NEW YORK,NY,NEW YORK,CHURCHES,-73.9445514,40.8274962,CHRISTIAN,EPIS,Y,N
SAINT MARYS EPISCOPAL CHURCH,NEW YORK,NY,NEW YORK,CHURCHES,-73.9560619,40.8148879,CHRISTIAN,EPIS,Y,N
SAINT MICHAELS CHURCH,NEW YORK,NY,NEW YORK,CHURCHES,-73.969084,40.7963238,CHRISTIAN,EPIS,Y,N
THE CHURCH OF THE RESURRECTION,NEW YORK,NY,NEW YORK,CHURCHES,-73.9620931,40.7723064,CHRISTIAN,EPIS,Y,N
CHURCH OF SAINT ALOYSIUS,NEW YORK,NY,NEW YORK,CHURCHES,-73.9456073,40.8138468,CHRISTIAN,NOT AVAILABLE,N,Y
SAINT MARTINS CHURCH,NEW YORK,NY,NEW YORK,CHURCHES,-73.9465308,40.8054365,CHRISTIAN,EPIS,Y,N
JEHOVAH-JIREH BAPTIST CHURCH OF CHRIST,NEW YORK,NY,NEW YORK,CHURCHES,-73.9477589,40.8276226,CHRISTIAN,NBC,Y,N
CHURCH OF THE HOLY AGONY,NEW YORK,NY,NEW YORK,CHURCHES,-73.947087,40.7886417,CHRISTIAN,NOT AVAILABLE,N,Y
CONGREGATION RODEPH SHOLOM,NEW YORK,NY,NEW YORK,SYNAGOGUES,-73.971002,40.7836861,JUDAIC,REFORM,N,N
INTERNATIONAL MUSLIM SOCIETY,NEW YORK,NY,NEW YORK,"MOSQUES, RELIGIOUS",-73.943917,40.8109224,MUSLIM,NOT AVAILABLE,N,N
CHURCH OF THE HOLY NAME OF JESUS,NEW YORK,NY,NEW YORK,CHURCHES,-73.970659,40.7945056,CHRISTIAN,NOT AVAILABLE,N,Y
KEHILAT ROMEMU,NEW YORK,NY,NEW YORK,SYNAGOGUES,-73.965767,40.7992532,JUDAIC,ALL,N,N
PARK AVENUE SYNAGOGUE,NEW YORK,NY,NEW YORK,SYNAGOGUES,-73.9581264,40.7811186,JUDAIC,NOT AVAILABLE,N,N
TEMPLE ISRAEL OF THE CITY OF NEW YORK,NEW YORK,NY,NEW YORK,SYNAGOGUES,-73.961877,40.7725031,JUDAIC,REFORM,N,N
92ND STREET Y,NEW YORK,NY,NEW YORK,SYNAGOGUES,-73.9527109,40.7828347,JUDAIC,NOT AVAILABLE,N,N
CONGREGATION RAMATH ORAH,NEW YORK,NY,NEW YORK,SYNAGOGUES,-73.9654107,40.8032977,JUDAIC,NOT AVAILABLE,N,N
CHABAD OF THE WEST SIDE,NEW YORK,NY,NEW YORK,SYNAGOGUES,-73.9698169,40.790812,JUDAIC,CHABAD,N,N
FORT TRYON JEWISH CENTER,NEW YORK,NY,NEW YORK,SYNAGOGUES,-73.9372133,40.8528111,JUDAIC,NOT AVAILABLE,N,N
YOUNG MEN AND YOUNG WOMEN HEBREW ASSOCIATION OF WASHINGTON HEIGHTS AND INWOOD,NEW YORK,NY,NEW YORK,SYNAGOGUES,-73.9295707,40.8601347,JUDAIC,NOT AVAILABLE,N,N
LISKER CONGREGATION,NEW YORK,NY,NEW YORK,SYNAGOGUES,-73.9627154,40.7684376,JUDAIC,NOT AVAILABLE,N,N
SOCIETY FOR THE ADVANCEMENT OF JUDAISM,NEW YORK,NY,NEW YORK,SYNAGOGUES,-73.9698935,40.7858501,JUDAIC,NOT AVAILABLE,N,N
SUTTON PLACE SYNAGOGUE,NEW YORK,NY,NEW YORK,SYNAGOGUES,-73.9690993,40.7562684,JUDAIC,NOT AVAILABLE,N,N
MANHATTAN SEPHARDIC CONGREGATION,NEW YORK,NY,NEW YORK,SYNAGOGUES,-73.9560624,40.7707141,JUDAIC,ORTHODOX-SEPHARDIC,N,N
CHABAD ISRAEL CENTER,NEW YORK,NY,NEW YORK,SYNAGOGUES,-73.9486935,40.7843724,JUDAIC,CHABAD,N,N
CENTRAL SYNAGOGUE,NEW YORK,NY,NEW YORK,SYNAGOGUES,-73.9702052,40.7600574,JUDAIC,REFORM,N,N
HEBREW TABERNACLE OF WASHINGTON HEIGHTS,NEW YORK,NY,NEW YORK,SYNAGOGUES,-73.9376538,40.8539098,JUDAIC,REFORM,N,N
CHABAD OF ROOSEVELT ISLAND,NEW YORK,NY,NEW YORK,SYNAGOGUES,-73.9429112,40.7696333,JUDAIC,CHABAD,N,N
CONGREGATION SHAARE ZEDEK,NEW YORK,NY,NEW YORK,SYNAGOGUES,-73.9724653,40.7920869,JUDAIC,NOT AVAILABLE,N,N
PARK EAST SYNAGOGUE CONGREGATION ZICHRON EPHRAIM,NEW YORK,NY,NEW YORK,SYNAGOGUES,-73.9636184,40.7671792,JUDAIC,NOT AVAILABLE,N,N
UPPER MIDTOWN CHABAD,NEW YORK,NY,NEW YORK,SYNAGOGUES,-73.9677193,40.7550206,JUDAIC,CHABAD,N,N
CONGREGATION ANSCHE CHESED,NEW YORK,NY,NEW YORK,SYNAGOGUES,-73.9707874,40.7972536,JUDAIC,NOT AVAILABLE,N,N
CONGREGATION EMANU-EL OF THE CITY OF NEW YORK,NEW YORK,NY,NEW YORK,SYNAGOGUES,-73.9694639,40.7680069,JUDAIC,REFORM,N,N
WASHINGTON HEIGHTS CONGREGATION,NEW YORK,NY,NEW YORK,SYNAGOGUES,-73.9401247,40.8497235,JUDAIC,NOT AVAILABLE,N,N
TEMPLE SHAARAY TEFILA,NEW YORK,NY,NEW YORK,SYNAGOGUES,-73.9561872,40.7734837,JUDAIC,REFORM,N,N
CHABAD RESOURCE CENTER OF COLUMBIA UNIVERSITY INCORPORATED,NEW YORK,NY,NEW YORK,SYNAGOGUES,-73.9659358,40.8066759,JUDAIC,CHABAD,N,N
CONGREGATION K'HAL ADATH JESHURUN,NEW YORK,NY,NEW YORK,SYNAGOGUES,-73.9350965,40.8527416,JUDAIC,NOT AVAILABLE,N,N
YORKVILLE SYNAGOGUE,NEW YORK,NY,NEW YORK,SYNAGOGUES,-73.9544759,40.7718684,JUDAIC,NOT AVAILABLE,N,N
CONGREGATION ORACHCHAIM,NEW YORK,NY,NEW YORK,SYNAGOGUES,-73.9513458,40.7847018,JUDAIC,NOT AVAILABLE,N,N
THE TEMPLE OF UNIVERSAL JUDAISM CONGREGATION DAAT ELOHIM,NEW YORK,NY,NEW YORK,SYNAGOGUES,-73.9583397,40.7794075,JUDAIC,REFORM,N,N
FIFTH AVENUE SYNAGOGUE,NEW YORK,NY,NEW YORK,SYNAGOGUES,-73.9709648,40.7661853,JUDAIC,ORTHODOX,N,N
BETH AM THE PEOPLES TEMPLE,NEW YORK,NY,NEW YORK,SYNAGOGUES,-73.9376524,40.8539142,JUDAIC,NOT AVAILABLE,N,N
THE JEWISH CENTER,NEW YORK,NY,NEW YORK,SYNAGOGUES,-73.9732298,40.7872652,JUDAIC,ORTHODOX,N,N
CHABAD LUBAVITCH OF THE UPPER EAST SIDE,NEW YORK,NY,NEW YORK,SYNAGOGUES,-73.9528465,40.7710123,JUDAIC,CHABAD,N,N
CONGREGATION OR ZARUA,NEW YORK,NY,NEW YORK,SYNAGOGUES,-73.9579995,40.7774663,JUDAIC,NOT AVAILABLE,N,N
EAST 55TH STREET CONSERVATIVE SYNAGOGUE,NEW YORK,NY,NEW YORK,SYNAGOGUES,-73.965933,40.757549,JUDAIC,NOT AVAILABLE,N,N
CONGREGATION SHMUEL JOSEF,NEW YORK,NY,NEW YORK,SYNAGOGUES,-73.9373544,40.8548689,JUDAIC,NOT AVAILABLE,N,N
SEPHARDIC SERVICES OF 5TH AVENUE,NEW YORK,NY,NEW YORK,SYNAGOGUES,-73.9709767,40.7661902,JUDAIC,ORTHODOX-SEPHARDIC,N,N
CHURCH OF SAINT JUDE,NEW YORK,NY,NEW YORK,CHURCHES,-73.9192459,40.8623509,CHRISTIAN,NOT AVAILABLE,N,Y
THE CHURCH OF THE ASCENSION,NEW YORK,NY,NEW YORK,CHURCHES,-73.9662866,40.801846,CHRISTIAN,NOT AVAILABLE,N,Y
SAINT STEPHEN OF HUNGARY CHURCH,NEW YORK,NY,NEW YORK,CHURCHES,-73.9505383,40.7737712,CHRISTIAN,NOT AVAILABLE,N,Y
ISLAMIC FELLOWSHIP OF HUNTER COLLEGE,NEW YORK,NY,NEW YORK,"MOSQUES, RELIGIOUS",-73.9648037,40.7685765,MUSLIM,NOT AVAILABLE,N,N
THE AMERICAN SOCIETY FOR MUSLIM ADVANCEMENT,NEW YORK,NY,NEW YORK,"MOSQUES, RELIGIOUS",-73.9499447,40.7857883,MUSLIM,NOT AVAILABLE,N,N
HOLY CROSS CATHOLIC CHURCH OF THE BYZANTINE RITE,NEW YORK,NY,NEW YORK,CHURCHES,-73.9525105,40.7750647,CHRISTIAN,NOT AVAILABLE,N,Y
COLUMBIA UNIVERSITY MUSLIM STUDENT ASSOCIATION,NEW YORK,NY,NEW YORK,"MOSQUES, RELIGIOUS",-73.9627001,40.8087184,MUSLIM,NOT AVAILABLE,N,N
CHURCH OF THE ANNUNCIATION,NEW YORK,NY,NEW YORK,CHURCHES,-73.953229,40.8162264,CHRISTIAN,NOT AVAILABLE,N,Y
GREATER BETHEL AFRICAN METHODIST EPISCOPAL CHURCH,NEW YORK,NY,NEW YORK,CHURCHES,-73.9461139,40.8061122,CHRISTIAN,AME,Y,N
ATLAH WORLD MISSIONARY CHURCH,NEW YORK,NY,NEW YORK,CHURCHES,-73.9462682,40.8061627,CHRISTIAN,ABC,Y,N
CHURCH OF THE RESSURECTION,NEW YORK,NY,NEW YORK,CHURCHES,-73.93801,40.8259137,CHRISTIAN,NOT AVAILABLE,N,Y
CHURCH OF ALL SAINTS,NEW YORK,NY,NEW YORK,CHURCHES,-73.9383199,40.8084086,CHRISTIAN,NOT AVAILABLE,N,Y
CHURCH OF SAINT ANN,NEW YORK,NY,NEW YORK,CHURCHES,-73.9400577,40.7927441,CHRISTIAN,NOT AVAILABLE,N,Y
CENTER FOR CULTURAL JUDAISM,NEW YORK,NY,NEW YORK,SYNAGOGUES,-74.0026902,40.7396983,JUDAIC,HUMANISTIC,N,N
CONGREGATION B'NAI ISRAEL,NEW YORK,NY,NEW YORK,SYNAGOGUES,-73.9803686,40.7885519,JUDAIC,NOT AVAILABLE,N,N
CONGREGATION HABONIM,NEW YORK,NY,NEW YORK,SYNAGOGUES,-73.9802581,40.7727069,JUDAIC,NOT AVAILABLE,N,N
ALL ANGELS CHURCH,NEW YORK,NY,NEW YORK,CHURCHES,-73.9799609,40.7850643,CHRISTIAN,EPIS,Y,N
RADIO CITY SYNAGOGUE,NEW YORK,NY,NEW YORK,SYNAGOGUES,-73.9801851,40.7571109,JUDAIC,NOT AVAILABLE,N,N
SHAMBHALA MEDITATION CENTER OF NEW YORK,NEW YORK,NY,NEW YORK,PLACES OF WORSHIP,-73.9944079,40.7424761,BUDDHIST,"MAHAYANA, TIBETAN, SHAMBHALA",N,N
NEW YORK INSIGHT MEDITATION CENTER - QUEER SANGHA,NEW YORK,NY,NEW YORK,PLACES OF WORSHIP,-73.9893744,40.7445301,BUDDHIST,NON-SECTARIAN,N,N
CHURCH OF OUR LADY OF GUADALUPE,NEW YORK,NY,NEW YORK,CHURCHES,-74.0008336,40.7393088,CHRISTIAN,NOT AVAILABLE,N,Y
SAINT TERESA CHURCH,NEW YORK,NY,NEW YORK,CHURCHES,-73.9904465,40.7135456,CHRISTIAN,NOT AVAILABLE,N,Y
THE CHURCH OF THE ASCENSION,NEW YORK,NY,NEW YORK,CHURCHES,-73.9957096,40.73377,CHRISTIAN,EPIS,Y,N
PALYUL CHANGCHUG DARGYELING NEW YORK CITY,NEW YORK,NY,NEW YORK,PLACES OF WORSHIP,-73.9929182,40.7433087,BUDDHIST,"TIBETAN, NYINGMAPA, PALYUL LINEAGE",N,N
HOLY TRINITY ROMAN CATHOLIC CHURCH,NEW YORK,NY,NEW YORK,CHURCHES,-73.9773191,40.7856015,CHRISTIAN,NOT AVAILABLE,N,Y
CHURCH OF SAINT CATHERINE OF SIENA,NEW YORK,NY,NEW YORK,CHURCHES,-73.957094,40.7652284,CHRISTIAN,NOT AVAILABLE,N,Y
CHURCH OF OUR LADY OF PEACE,NEW YORK,NY,NEW YORK,CHURCHES,-73.9635577,40.7629829,CHRISTIAN,NOT AVAILABLE,N,Y
SAINT JEAN BAPTISTE CATHOLIC CHURCH,NEW YORK,NY,NEW YORK,CHURCHES,-73.9600295,40.7726368,CHRISTIAN,NOT AVAILABLE,N,Y
CORPUS CHRISTI CHURCH,NEW YORK,NY,NEW YORK,CHURCHES,-73.9607601,40.8111049,CHRISTIAN,NOT AVAILABLE,N,Y
THE CHURCH OF THE HOLY TRINITY,NEW YORK,NY,NEW YORK,CHURCHES,-73.9495418,40.7783272,CHRISTIAN,EPIS,Y,N
METROPOLITAN BAPTIST CHURCH,NEW YORK,NY,NEW YORK,CHURCHES,-73.9464066,40.8109192,CHRISTIAN,NBC,Y,N
CHURCH OF SAINT GREGORY THE GREAT,NEW YORK,NY,NEW YORK,CHURCHES,-73.9722395,40.7896626,CHRISTIAN,NOT AVAILABLE,N,Y
PRINCE OF PEACE BAPTIST CHURCH,NEW YORK,NY,NEW YORK,CHURCHES,-73.937457,40.843787,CHRISTIAN,ABC,Y,N
ALL SOULS CHURCH,NEW YORK,NY,NEW YORK,CHURCHES,-73.9521647,40.8016997,CHRISTIAN,EPIS,Y,N
SECOND SPANISH BAPTIST CHURCH,NEW YORK,NY,NEW YORK,CHURCHES,-73.94747,40.7896422,CHRISTIAN,ABC,Y,N
SAINT ROSE OF LIMA CHURCH,NEW YORK,NY,NEW YORK,CHURCHES,-73.9391469,40.8379499,CHRISTIAN,NOT AVAILABLE,N,Y
SAINT PAUL BAPTIST CHURCH,NEW YORK,NY,NEW YORK,CHURCHES,-73.9465338,40.8142269,CHRISTIAN,ABC,Y,N
SAINT ANDREWS EPISCOPAL CHURCH,NEW YORK,NY,NEW YORK,CHURCHES,-73.9407823,40.8077238,CHRISTIAN,EPIS,Y,N
HUNGARIAN BAPTIST CHURCH,NEW YORK,NY,NEW YORK,CHURCHES,-73.9555444,40.7746293,CHRISTIAN,ABC,Y,N
THE CHURCH OF SAINT VINCENT FERRER,NEW YORK,NY,NEW YORK,CHURCHES,-73.9645899,40.7661933,CHRISTIAN,NOT AVAILABLE,N,Y
CHURCH SAINT JOSEPH OF THE HOLY FAMILY,NEW YORK,NY,NEW YORK,CHURCHES,-73.9540452,40.8117589,CHRISTIAN,NOT AVAILABLE,N,Y
CATHOLIC CHURCH OF SAINT JOHN THE MARTYR,NEW YORK,NY,NEW YORK,CHURCHES,-73.9591128,40.7688493,CHRISTIAN,NOT AVAILABLE,N,Y
SAINT EDWARD THE MARTYR CHURCH,NEW YORK,NY,NEW YORK,CHURCHES,-73.9491062,40.7957203,CHRISTIAN,EPIS,Y,N
THY WILL BE DONE CHRISTIAN MINISTRIES,NEW YORK,NY,NEW YORK,CHURCHES,-73.9465535,40.7900582,CHRISTIAN,ABC,Y,N
FIRST CORINTHIAN BAPTIST CHURCH,NEW YORK,NY,NEW YORK,CHURCHES,-73.9531468,40.8031823,CHRISTIAN,ABC,Y,N
CHURCH OF SAINT ELIZABETH,NEW YORK,NY,NEW YORK,CHURCHES,-73.9327089,40.8535,CHRISTIAN,NOT AVAILABLE,N,Y
CHURCH OF SAINT THOMAS MORE,NEW YORK,NY,NEW YORK,CHURCHES,-73.956699,40.7827735,CHRISTIAN,NOT AVAILABLE,N,Y
CHURCH OF SAINT LUCY,NEW YORK,NY,NEW YORK,CHURCHES,-73.9419493,40.7884612,CHRISTIAN,NOT AVAILABLE,N,Y
CHURCH OF SAINT CHARLES BORROMEO,NEW YORK,NY,NEW YORK,CHURCHES,-73.9417926,40.8197839,CHRISTIAN,NOT AVAILABLE,N,Y
UNION BAPTIST CHURCH,NEW YORK,NY,NEW YORK,CHURCHES,-73.9408543,40.8221412,CHRISTIAN,ABC,Y,N
TRINITY BAPTIST CHURCH,NEW YORK,NY,NEW YORK,CHURCHES,-73.9641189,40.7619094,CHRISTIAN,ABC,Y,N
CHURCH OF SAINT MONICA,NEW YORK,NY,NEW YORK,CHURCHES,-73.9518423,40.7723621,CHRISTIAN,NOT AVAILABLE,N,Y
SAINT JOHN NEPOMUCENE CHURCH,NEW YORK,NY,NEW YORK,CHURCHES,-73.9582996,40.7640073,CHRISTIAN,NOT AVAILABLE,N,Y
SAINT LUKES EPISCOPAL CHURCH,NEW YORK,NY,NEW YORK,CHURCHES,-73.9475054,40.8220857,CHRISTIAN,EPIS,Y,N
SAINT MATTHEWS BAPTIST CHURCH,NEW YORK,NY,NEW YORK,CHURCHES,-73.9383699,40.8267249,CHRISTIAN,ABC,Y,N
MOUNT OLIVET BAPTIST CHURCH,NEW YORK,NY,NEW YORK,CHURCHES,-73.9480782,40.8049335,CHRISTIAN,NBC,Y,N
FRIENDSHIP BAPTIST CHURCH,NEW YORK,NY,NEW YORK,CHURCHES,-73.9446861,40.812133,CHRISTIAN,NBC,Y,N
FIRST SHARON BAPTIST CHURCH,NEW YORK,NY,NEW YORK,CHURCHES,-73.9384912,40.797609,CHRISTIAN,NBC,Y,N
BETHANY BAPTIST CHURCH,NEW YORK,NY,NEW YORK,CHURCHES,-73.9386812,40.8282938,CHRISTIAN,NBC,Y,N
NEW MOUNT ZION BAPTIST CHURCH,NEW YORK,NY,NEW YORK,CHURCHES,-73.9406378,40.8183978,CHRISTIAN,NBC,Y,N
MOUNT MORIAH BAPTIST CHURCH,NEW YORK,NY,NEW YORK,CHURCHES,-73.9418562,40.807574,CHRISTIAN,NBC,Y,N
THE RIVERSIDE CHURCH,NEW YORK,NY,NEW YORK,CHURCHES,-73.9631337,40.8119025,CHRISTIAN,ABC,Y,N
GLENDALE BAPTIST CHURCH,NEW YORK,NY,NEW YORK,CHURCHES,-73.9455093,40.8105248,CHRISTIAN,NBC,Y,N
SAINT JOHN AFRICAN METHODIST EPISCOPAL CHURCH,NEW YORK,NY,NEW YORK,CHURCHES,-73.9433508,40.8141219,CHRISTIAN,AME,Y,N
SAINT LUKE BAPTIST CHURCH,NEW YORK,NY,NEW YORK,CHURCHES,-73.9545197,40.8102292,CHRISTIAN,NBC,Y,N
SAINT JOHNS BAPTIST CHURCH,NEW YORK,NY,NEW YORK,CHURCHES,-73.9429547,40.8287803,CHRISTIAN,NBC,Y,N
NEW MOUNT CALVARY BAPTIST CHURCH,NEW YORK,NY,NEW YORK,CHURCHES,-73.93745,40.8198364,CHRISTIAN,NBC,Y,N
SAINT PHILIPS CHURCH,NEW YORK,NY,NEW YORK,CHURCHES,-73.9451678,40.81479,CHRISTIAN,EPIS,Y,N
MOSQUE OF ISLAMIC BROTHERHOOD INCORPORATED,NEW YORK,NY,NEW YORK,"MOSQUES, RELIGIOUS",-73.9527409,40.8006501,MUSLIM,NOT AVAILABLE,N,N
VAJRAKILAYA CENTRES PEMA NYING THIG CHOKOR LING,NEW YORK,NY,NEW YORK,PLACES OF WORSHIP,-73.9531993,40.7862167,BUDDHIST,NYINGMAPA,N,N
CARNEGIE HILL ZEN CENTER,NEW YORK,NY,NEW YORK,PLACES OF WORSHIP,-73.9523345,40.7853828,BUDDHIST,"MAHAYANA, ZEN",N,N
MOUNT PISGAH AFRICAN METHODIST EPISCOPAL CHURCH,NEW YORK,NY,NEW YORK,CHURCHES,-73.9451403,40.802862,CHRISTIAN,AME,Y,N
MASJID SALAM,NEW YORK,NY,NEW YORK,"MOSQUES, RELIGIOUS",-73.9536461,40.8039432,MUSLIM,NOT AVAILABLE,N,N
MUHAMMAD MOSQUE NUMBER 7,NEW YORK,NY,NEW YORK,"MOSQUES, RELIGIOUS",-73.9452471,40.8091213,MUSLIM,NOT AVAILABLE,N,N
MOUNT ZION AFRICAN METHODIST EPISCOPAL CHURCH,NEW YORK,NY,NEW YORK,CHURCHES,-73.9447271,40.7996976,CHRISTIAN,AME,Y,N
FRIENDS OF THE WESTERN BUDDHIST ORDER NEW YORK CITY,NEW YORK,NY,NEW YORK,PLACES OF WORSHIP,-73.9617412,40.8002572,BUDDHIST,MAHAYANA / WESTERN (FWBO),N,N
CHURCH OF SAINT FRANCIS XAVIER CABRINI,NEW YORK,NY,NEW YORK,CHURCHES,-73.9491017,40.7624671,CHRISTIAN,NOT AVAILABLE,N,Y
ALIANZA ISLAMICA,NEW YORK,NY,NEW YORK,"MOSQUES, RELIGIOUS",-73.9461014,40.7928328,MUSLIM,NOT AVAILABLE,N,N
NEW YORK BUDDHIST CHURCH,NEW YORK,NY,NEW YORK,PLACES OF WORSHIP,-73.9701492,40.8017302,BUDDHIST,JODO SHINSHU BUDDHISM,N,N
NEW YORK ZENDO SHOBO-JI,NEW YORK,NY,NEW YORK,PLACES OF WORSHIP,-73.9615268,40.766204,BUDDHIST,"THERAVADA, LAOTIAN",N,N
REDEEMER PRESBYTERIAN CHURCH,NEW YORK,NY,NEW YORK,CHURCHES,-73.9648051,40.768576,CHRISTIAN,PCA,Y,N
MARANATHA BAPTIST CHURCH,NEW YORK,NY,NEW YORK,CHURCHES,-73.9730303,40.7840939,CHRISTIAN,BAPT,Y,N
CHURCH ON THE HILL AFRICAN METHODIST EPISCOPAL ZION CHURCH,NEW YORK,NY,NEW YORK,CHURCHES,-73.9405764,40.8342143,CHRISTIAN,AMEZ,Y,N
SAINT VERONICA CHURCH,NEW YORK,NY,NEW YORK,CHURCHES,-74.0079659,40.7330271,CHRISTIAN,NOT AVAILABLE,N,Y
CHURCH OF SAINT ANDREW,NEW YORK,NY,NEW YORK,CHURCHES,-74.0026056,40.7133423,CHRISTIAN,NOT AVAILABLE,N,Y
SAINT GEORGE UKRANIAN CATHOLIC CHURCH,NEW YORK,NY,NEW YORK,CHURCHES,-73.9898002,40.728481,CHRISTIAN,NOT AVAILABLE,N,Y
ORDINARY MIND ZENDO,NEW YORK,NY,NEW YORK,PLACES OF WORSHIP,-73.9783486,40.7791479,BUDDHIST,"TIBETAN, NYINGMAPA, ARO TER LINEAGE",N,N
ONE CENTER,NEW YORK,NY,NEW YORK,PLACES OF WORSHIP,-74.0066777,40.7073681,BUDDHIST,CH'AN (CHINESE ZEN),N,N
IGLESIA ADVENTISTA DEL SEPTIMO DIA,WEST NEW YORK,NJ,HUDSON,CHURCHES,-74.0172189,40.7825361,CHRISTIAN,NOT AVAILABLE,Y,N
SAINT ANN CATHEDRAL,NEW YORK,NY,NEW YORK,CHURCHES,-73.989271,40.7321049,CHRISTIAN,NOT AVAILABLE,N,Y
SAINT BENEDICT THE MOOR ROMAN CATHOLIC CHURCH,NEW YORK,NY,NEW YORK,CHURCHES,-73.9863292,40.764512,CHRISTIAN,NOT AVAILABLE,N,Y
EPIPHANY ROMAN CATHOLIC CHURCH,NEW YORK,NY,NEW YORK,CHURCHES,-73.9819463,40.7371241,CHRISTIAN,NOT AVAILABLE,N,Y
MISSION SAN PABLO,NEW YORK,NY,NEW YORK,CHURCHES,-74.0017698,40.7438996,CHRISTIAN,EPIS,Y,N
CHURCH OF THE HOLY APOSTLES,NEW YORK,NY,NEW YORK,CHURCHES,-73.9989866,40.7490815,CHRISTIAN,EPIS,Y,N
SAINT GEORGE'S CHURCH,NEW YORK,NY,NEW YORK,CHURCHES,-73.9850402,40.7344562,CHRISTIAN,EPIS,Y,N
SAINT BARTHOLOMEW'S CHURCH,NEW YORK,NY,NEW YORK,CHURCHES,-73.9733482,40.7572474,CHRISTIAN,EPIS,Y,N
NEW YORK ZEN CENTER FOR CONTEMPLATIVE CARE,NEW YORK CITY,NY,NEW YORK,PLACES OF WORSHIP,-74.0007588,40.7363019,BUDDHIST,"MAHAYANA, ZEN",N,N
SAINT CYRIL CHURCH (FRANCISCAN) / (SLOVENIAN),NEW YORK,NY,NEW YORK,CHURCHES,-73.9865593,40.7277931,CHRISTIAN,NOT AVAILABLE,N,Y
CHURCH OF THE SACRED HEART OF JESUS,NEW YORK,NY,NEW YORK,CHURCHES,-73.9899167,40.7650444,CHRISTIAN,NOT AVAILABLE,N,Y
SAINT FRANCIS OF ASSISI CHURCH,NEW YORK,NY,NEW YORK,CHURCHES,-73.9906174,40.7488374,CHRISTIAN,NOT AVAILABLE,N,Y
SAINT PETER'S CHURCH - CHELSEA,NEW YORK,NY,NEW YORK,CHURCHES,-74.0017792,40.7439036,CHRISTIAN,EPIS,Y,N
CALVARY CHURCH,NEW YORK,NY,NEW YORK,CHURCHES,-73.9867047,40.7390178,CHRISTIAN,EPIS,Y,N
THE CHURCH OF OUR SAVIOR,NEW YORK,NY,NEW YORK,CHURCHES,-73.9792812,40.7491377,CHRISTIAN,NOT AVAILABLE,N,Y
SHRINE OF SAINT ELIZABETH ANN SETON CHURCH OF OUR LADY OF THE ROSARY,NEW YORK,NY,NEW YORK,CHURCHES,-74.0133199,40.7026583,CHRISTIAN,NOT AVAILABLE,N,Y
